{
  "$schema": "https://json-schema.org/draft/2020-12/schema",
  "$id": "https://workline.dev/schemas/design-revocation.v1.schema.json",
  "title": "Workline design revocation record v1",
  "description": "An explicit, audited block on one exact baseline revision. The ONLY thing that forbids executing against a published revision.",
  "type": "object",
  "additionalProperties": false,
  "required": ["schema", "id", "target", "target_digest", "author", "date", "reason", "digest"],
  "properties": {
    "schema": {
      "const": "workline.design-revocation/v1"
    },
    "id": {
      "type": "string",
      "pattern": "^RVK-(?:[0-9]{3}|[1-9][0-9]{3,})$"
    },
    "target": {
      "description": "The exact baseline this record decides on.",
      "$ref": "#/$defs/baselineRef"
    },
    "target_digest": {
      "description": "The digest that baseline had. A record decides on BYTES, not on a name.",
      "$ref": "#/$defs/digest"
    },
    "author": {
      "description": "Who decided, or the role that did.",
      "type": "string",
      "minLength": 1
    },
    "date": {
      "type": "string",
      "pattern": "^[0-9]{4}-[0-9]{2}-[0-9]{2}$"
    },
    "reason": {
      "description": "Why this revision must not be executed. Not optional: a block without a reason is not auditable.",
      "type": "string",
      "minLength": 1
    },
    "digest": {
      "description": "SHA-256 of this record's canonical JSON WITHOUT this field.",
      "$ref": "#/$defs/digest"
    }
  },
  "$defs": {
    "baselineRef": {
      "type": "string",
      "pattern": "^DES-(?:[0-9]{3}|[1-9][0-9]{3,})@r[1-9][0-9]{0,5}$"
    },
    "digest": {
      "type": "string",
      "pattern": "^sha256:[0-9a-f]{64}$"
    }
  }
}
